12:38:42.199600 IP 192-168-0-188.rdsnet.ro.40216 > 162.125.21.2.https: Flags [P.], seq 2447733189:2447733281, ack 786201636, win 501, options [nop,nop,TS val 2157751853 ecr 1211436292], length 92
12:38:42.419340 IP 162.125.21.2.https > 192-168-0-188.rdsnet.ro.40216: Flags [.], ack 92, win 250, options [nop,nop,TS val 1211465096 ecr 2157751853], length 0
12:38:42.419358 IP 192-168-0-188.rdsnet.ro.40216 > 162.125.21.2.https: Flags [P.], seq 92:1255, ack 1, win 501, options [nop,nop,TS val 2157752072 ecr 1211465096], length 1163
12:38:42.623869 IP 162.125.21.2.https > 192-168-0-188.rdsnet.ro.40216: Flags [.], ack 1255, win 250, options [nop,nop,TS val 1211465269 ecr 2157752072], length 0
12:38:42.623884 IP 162.125.21.2.https > 192-168-0-188.rdsnet.ro.40216: Flags [P.], seq 1:124, ack 1255, win 250, options [nop,nop,TS val 1211465270 ecr 2157752072], length 123
12:38:42.623895 IP 192-168-0-188.rdsnet.ro.40216 > 162.125.21.2.https: Flags [.], ack 124, win 501, options [nop,nop,TS val 2157752277 ecr 1211465270], length 0
12:38:43.133990 IP 192-168-0-188.rdsnet.ro.37893 > 192-168-0-1.rdsnet.ro.domain: 50134+ [1au] PTR? 2.21.125.162.in-addr.arpa. (54)
12:38:43.143404 IP 192-168-0-1.rdsnet.ro.domain > 192-168-0-188.rdsnet.ro.37893: 50134 NXDomain 0/1/1 (104)
12:38:43.143546 IP 192-168-0-188.rdsnet.ro.37893 > 192-168-0-1.rdsnet.ro.domain: 50134+ PTR? 2.21.125.162.in-addr.arpa. (43)
12:38:43.145703 IP 192-168-0-1.rdsnet.ro.domain > 192-168-0-188.rdsnet.ro.37893: 50134 NXDomain 0/0/0 (43)
12:38:45.908820 IP 192-168-0-188.rdsnet.ro.48224 > 192-168-0-1.rdsnet.ro.domain: 62931+ [1au] A? forms.gle. (38)
12:38:45.908885 IP 192-168-0-188.rdsnet.ro.35106 > 192-168-0-1.rdsnet.ro.domain: 19737+ [1au] AAAA? forms.gle. (38)
12:38:45.919939 IP 192-168-0-188.rdsnet.ro.17500 > 255.255.255.255.17500: UDP, length 171
12:38:45.920451 IP 192-168-0-188.rdsnet.ro.17500 > 192-168-0-255.rdsnet.ro.17500: UDP, length 171
12:38:45.921399 IP 192-168-0-1.rdsnet.ro.domain > 192-168-0-188.rdsnet.ro.48224: 62931 1/0/1 A 199.36.158.100 (54)
12:38:45.928563 IP 192-168-0-1.rdsnet.ro.domain > 192-168-0-188.rdsnet.ro.35106: 19737 1/0/1 AAAA 2620:0:890::100 (66)
12:38:45.930228 IP 192-168-0-188.rdsnet.ro.37578 > 199.36.158.100.https: Flags [S], seq 1379236734, win 64240, options [mss 1460,sackOK,TS val 3254722299 ecr 0,nop,wscale 7], length 0
12:38:45.963886 IP 199.36.158.100.https > 192-168-0-188.rdsnet.ro.37578: Flags [S.], seq 2520744605, ack 1379236735, win 65535, options [mss 1412,sackOK,TS val 727587845 ecr 3254722299,nop,wscale 9], length 0
12:38:45.963909 IP 192-168-0-188.rdsnet.ro.37578 > 199.36.158.100.https: Flags [.], ack 1, win 502, options [nop,nop,TS val 3254722333 ecr 727587845], length 0
12:38:45.964946 IP 192-168-0-188.rdsnet.ro.37578 > 199.36.158.100.https: Flags [P.], seq 1:658, ack 1, win 502, options [nop,nop,TS val 3254722334 ecr 727587845], length 657
12:38:46.000385 IP 199.36.158.100.https > 192-168-0-188.rdsnet.ro.37578: Flags [.], ack 658, win 282, options [nop,nop,TS val 727587880 ecr 3254722334], length 0
12:38:46.006132 IP 199.36.158.100.https > 192-168-0-188.rdsnet.ro.37578: Flags [P.], seq 1:2801, ack 658, win 282, options [nop,nop,TS val 727587888 ecr 3254722334], length 2800
12:38:46.006141 IP 192-168-0-188.rdsnet.ro.37578 > 199.36.158.100.https: Flags [.], ack 2801, win 481, options [nop,nop,TS val 3254722375 ecr 727587888], length 0
12:38:46.006174 IP 199.36.158.100.https > 192-168-0-188.rdsnet.ro.37578: Flags [P.], seq 2801:5435, ack 658, win 282, options [nop,nop,TS val 727587888 ecr 3254722334], length 2634
12:38:46.006176 IP 192-168-0-188.rdsnet.ro.37578 > 199.36.158.100.https: Flags [.], ack 5435, win 461, options [nop,nop,TS val 3254722375 ecr 727587888], length 0
12:38:46.008399 IP 192-168-0-188.rdsnet.ro.37578 > 199.36.158.100.https: Flags [P.], seq 658:722, ack 5435, win 477, options [nop,nop,TS val 3254722377 ecr 727587888], length 64
12:38:46.008607 IP 192-168-0-188.rdsnet.ro.37578 > 199.36.158.100.https: Flags [P.], seq 722:892, ack 5435, win 501, options [nop,nop,TS val 3254722378 ecr 727587888], length 170
12:38:46.008864 IP 192-168-0-188.rdsnet.ro.37578 > 199.36.158.100.https: Flags [P.], seq 892:1248, ack 5435, win 501, options [nop,nop,TS val 3254722378 ecr 727587888], length 356
12:38:46.041178 IP 199.36.158.100.https > 192-168-0-188.rdsnet.ro.37578: Flags [.], ack 722, win 282, options [nop,nop,TS val 727587923 ecr 3254722377], length 0
12:38:46.041185 IP 199.36.158.100.https > 192-168-0-188.rdsnet.ro.37578: Flags [.], ack 892, win 285, options [nop,nop,TS val 727587923 ecr 3254722378], length 0
12:38:46.041187 IP 199.36.158.100.https > 192-168-0-188.rdsnet.ro.37578: Flags [P.], seq 5435:5494, ack 892, win 285, options [nop,nop,TS val 727587923 ecr 3254722378], length 59
12:38:46.041335 IP 192-168-0-188.rdsnet.ro.37578 > 199.36.158.100.https: Flags [P.], seq 1248:1279, ack 5494, win 501, options [nop,nop,TS val 3254722410 ecr 727587923], length 31
12:38:46.042341 IP 199.36.158.100.https > 192-168-0-188.rdsnet.ro.37578: Flags [.], ack 1248, win 287, options [nop,nop,TS val 727587924 ecr 3254722378], length 0
12:38:46.073387 IP 199.36.158.100.https > 192-168-0-188.rdsnet.ro.37578: Flags [.], ack 1279, win 287, options [nop,nop,TS val 727587956 ecr 3254722410], length 0
12:38:46.206362 IP 192-168-0-188.rdsnet.ro.49105 > 192-168-0-1.rdsnet.ro.domain: 8200+ [1au] PTR? 100.158.36.199.in-addr.arpa. (56)
12:38:46.209252 IP 199.36.158.100.https > 192-168-0-188.rdsnet.ro.37578: Flags [P.], seq 5494:6724, ack 1279, win 287, options [nop,nop,TS val 727588091 ecr 3254722410], length 1230
12:38:46.211874 IP 192-168-0-188.rdsnet.ro.33857 > 199.36.158.100.https: UDP, length 1357
12:38:46.213785 IP 192-168-0-188.rdsnet.ro.34657 > 192-168-0-1.rdsnet.ro.domain: 13123+ [1au] A? docs.google.com. (44)
12:38:46.213844 IP 192-168-0-188.rdsnet.ro.40792 > 192-168-0-1.rdsnet.ro.domain: 15307+ [1au] AAAA? docs.google.com. (44)
12:38:46.226578 IP 192-168-0-1.rdsnet.ro.domain > 192-168-0-188.rdsnet.ro.40792: 15307 1/0/1 AAAA 2a00:1450:400d:80e::200e (72)
12:38:46.232018 IP 192-168-0-1.rdsnet.ro.domain > 192-168-0-188.rdsnet.ro.34657: 13123 1/0/1 A 142.250.201.206 (60)
12:38:46.234066 IP 192-168-0-188.rdsnet.ro.49806 > bud02s35-in-f14.1e100.net.https: Flags [S], seq 3327771023, win 64240, options [mss 1460,sackOK,TS val 268305273 ecr 0,nop,wscale 7], length 0
12:38:46.249492 IP 192-168-0-188.rdsnet.ro.37578 > 199.36.158.100.https: Flags [.], ack 6724, win 501, options [nop,nop,TS val 3254722619 ecr 727588091], length 0
12:38:46.250876 IP bud02s35-in-f14.1e100.net.https > 192-168-0-188.rdsnet.ro.49806: Flags [S.], seq 1677986540, ack 3327771024, win 65535, options [mss 1412,sackOK,TS val 2800373273 ecr 268305273,nop,wscale 8], length 0
12:38:46.250919 IP 199.36.158.100.https > 192-168-0-188.rdsnet.ro.33857: UDP, length 1357
12:38:46.250920 IP 192-168-0-188.rdsnet.ro.49806 > bud02s35-in-f14.1e100.net.https: Flags [.], ack 1, win 502, options [nop,nop,TS val 268305290 ecr 2800373273], length 0
12:38:46.250927 IP 199.36.158.100.https > 192-168-0-188.rdsnet.ro.33857: UDP, length 1357
12:38:46.250928 IP 199.36.158.100.https > 192-168-0-188.rdsnet.ro.33857: UDP, length 1357
12:38:46.250929 IP 199.36.158.100.https > 192-168-0-188.rdsnet.ro.33857: UDP, length 1312
12:38:46.251558 IP 192-168-0-188.rdsnet.ro.33857 > 199.36.158.100.https: UDP, length 51
12:38:46.252414 IP 192-168-0-188.rdsnet.ro.49806 > bud02s35-in-f14.1e100.net.https: Flags [P.], seq 1:664, ack 1, win 502, options [nop,nop,TS val 268305291 ecr 2800373273], length 663
12:38:46.253873 IP 192-168-0-1.rdsnet.ro.domain > 192-168-0-188.rdsnet.ro.49105: 8200 NXDomain 0/1/1 (116)
12:38:46.253939 IP 192-168-0-188.rdsnet.ro.33857 > 199.36.158.100.https: UDP, length 126
12:38:46.253955 IP 192-168-0-188.rdsnet.ro.33857 > 199.36.158.100.https: UDP, length 71
12:38:46.253981 IP 192-168-0-188.rdsnet.ro.37578 > 199.36.158.100.https: Flags [P.], seq 1279:1318, ack 6724, win 501, options [nop,nop,TS val 3254722623 ecr 727588091], length 39
12:38:46.254034 IP 192-168-0-188.rdsnet.ro.49105 > 192-168-0-1.rdsnet.ro.domain: 8200+ PTR? 100.158.36.199.in-addr.arpa. (45)
12:38:46.254097 IP 192-168-0-188.rdsnet.ro.37578 > 199.36.158.100.https: Flags [FP.], seq 1318:1342, ack 6724, win 501, options [nop,nop,TS val 3254722623 ecr 727588091], length 24
12:38:46.257042 IP 192-168-0-1.rdsnet.ro.domain > 192-168-0-188.rdsnet.ro.49105: 8200 NXDomain 0/0/0 (45)
12:38:46.269515 IP bud02s35-in-f14.1e100.net.https > 192-168-0-188.rdsnet.ro.49806: Flags [.], ack 664, win 262, options [nop,nop,TS val 2800373291 ecr 268305291], length 0
12:38:46.285126 IP 199.36.158.100.https > 192-168-0-188.rdsnet.ro.33857: UDP, length 24
12:38:46.286180 IP 199.36.158.100.https > 192-168-0-188.rdsnet.ro.37578: Flags [.], ack 1318, win 287, options [nop,nop,TS val 727588168 ecr 3254722623], length 0
12:38:46.287249 IP 199.36.158.100.https > 192-168-0-188.rdsnet.ro.37578: Flags [.], ack 1343, win 287, options [nop,nop,TS val 727588169 ecr 3254722623], length 0
12:38:46.287260 IP 199.36.158.100.https > 192-168-0-188.rdsnet.ro.37578: Flags [P.], seq 6724:6748, ack 1343, win 287, options [nop,nop,TS val 727588169 ecr 3254722623], length 24
12:38:46.287268 IP 192-168-0-188.rdsnet.ro.37578 > 199.36.158.100.https: Flags [R], seq 1379238077, win 0, length 0
12:38:46.288568 IP 199.36.158.100.https > 192-168-0-188.rdsnet.ro.37578: Flags [F.], seq 6748, ack 1343, win 287, options [nop,nop,TS val 727588169 ecr 3254722623], length 0
12:38:46.288574 IP 192-168-0-188.rdsnet.ro.37578 > 199.36.158.100.https: Flags [R], seq 1379238077, win 0, length 0
12:38:46.289058 IP bud02s35-in-f14.1e100.net.https > 192-168-0-188.rdsnet.ro.49806: Flags [P.], seq 1:2801, ack 664, win 262, options [nop,nop,TS val 2800373311 ecr 268305291], length 2800
12:38:46.289066 IP 192-168-0-188.rdsnet.ro.49806 > bud02s35-in-f14.1e100.net.https: Flags [.], ack 2801, win 481, options [nop,nop,TS val 268305328 ecr 2800373311], length 0
12:38:46.289070 IP bud02s35-in-f14.1e100.net.https > 192-168-0-188.rdsnet.ro.49806: Flags [P.], seq 2801:5601, ack 664, win 262, options [nop,nop,TS val 2800373311 ecr 268305291], length 2800
12:38:46.289072 IP 192-168-0-188.rdsnet.ro.49806 > bud02s35-in-f14.1e100.net.https: Flags [.], ack 5601, win 460, options [nop,nop,TS val 268305328 ecr 2800373311], length 0
12:38:46.290037 IP bud02s35-in-f14.1e100.net.https > 192-168-0-188.rdsnet.ro.49806: Flags [P.], seq 5601:6774, ack 664, win 262, options [nop,nop,TS val 2800373312 ecr 268305291], length 1173
12:38:46.290043 IP 192-168-0-188.rdsnet.ro.49806 > bud02s35-in-f14.1e100.net.https: Flags [.], ack 6774, win 493, options [nop,nop,TS val 268305329 ecr 2800373312], length 0
12:38:46.293200 IP 192-168-0-188.rdsnet.ro.50189 > 192-168-0-1.rdsnet.ro.domain: 9007+ [1au] A? ocsp.pki.goog. (42)
12:38:46.293260 IP 192-168-0-188.rdsnet.ro.42440 > 192-168-0-1.rdsnet.ro.domain: 12021+ [1au] AAAA? ocsp.pki.goog. (42)
12:38:46.303491 IP 192-168-0-1.rdsnet.ro.domain > 192-168-0-188.rdsnet.ro.50189: 9007 2/0/1 CNAME pki-goog.l.google.com., A 172.217.19.99 (93)
12:38:46.305933 IP 192-168-0-188.rdsnet.ro.33857 > 199.36.158.100.https: UDP, length 41
12:38:46.311058 IP 192-168-0-1.rdsnet.ro.domain > 192-168-0-188.rdsnet.ro.42440: 12021 2/0/1 CNAME pki-goog.l.google.com., AAAA 2a00:1450:400d:80e::2003 (105)
12:38:46.311072 IP 199.36.158.100.https > 192-168-0-188.rdsnet.ro.33857: UDP, length 27
12:38:46.311626 IP 192-168-0-188.rdsnet.ro.53186 > muc03s07-in-f99.1e100.net.http: Flags [S], seq 3813119656, win 64240, options [mss 1460,sackOK,TS val 3108560911 ecr 0,nop,wscale 7], length 0
12:38:46.354711 IP muc03s07-in-f99.1e100.net.http > 192-168-0-188.rdsnet.ro.53186: Flags [S.], seq 2365202376, ack 3813119657, win 65535, options [mss 1412,sackOK,TS val 2129475788 ecr 3108560911,nop,wscale 8], length 0
12:38:46.354764 IP 192-168-0-188.rdsnet.ro.53186 > muc03s07-in-f99.1e100.net.http: Flags [.], ack 1, win 502, options [nop,nop,TS val 3108560954 ecr 2129475788], length 0
12:38:46.354917 IP 192-168-0-188.rdsnet.ro.53186 > muc03s07-in-f99.1e100.net.http: Flags [P.], seq 1:427, ack 1, win 502, options [nop,nop,TS val 3108560954 ecr 2129475788], length 426: HTTP: POST /gts1c3 HTTP/1.1
12:38:46.398242 IP muc03s07-in-f99.1e100.net.http > 192-168-0-188.rdsnet.ro.53186: Flags [.], ack 427, win 261, options [nop,nop,TS val 2129475831 ecr 3108560954], length 0
12:38:46.437762 IP muc03s07-in-f99.1e100.net.http > 192-168-0-188.rdsnet.ro.53186: Flags [P.], seq 1:702, ack 427, win 261, options [nop,nop,TS val 2129475871 ecr 3108560954], length 701: HTTP: HTTP/1.1 200 OK
12:38:46.437779 IP 192-168-0-188.rdsnet.ro.53186 > muc03s07-in-f99.1e100.net.http: Flags [.], ack 702, win 497, options [nop,nop,TS val 3108561037 ecr 2129475871], length 0
12:38:46.438653 IP 192-168-0-188.rdsnet.ro.49806 > bud02s35-in-f14.1e100.net.https: Flags [P.], seq 664:728, ack 6774, win 501, options [nop,nop,TS val 268305478 ecr 2800373312], length 64
12:38:46.438797 IP 192-168-0-188.rdsnet.ro.49806 > bud02s35-in-f14.1e100.net.https: Flags [P.], seq 728:898, ack 6774, win 501, options [nop,nop,TS val 268305478 ecr 2800373312], length 170
12:38:46.438804 IP 192-168-0-188.rdsnet.ro.49806 > bud02s35-in-f14.1e100.net.https: Flags [P.], seq 898:2716, ack 6774, win 501, options [nop,nop,TS val 268305478 ecr 2800373312], length 1818
12:38:46.454397 IP bud02s35-in-f14.1e100.net.https > 192-168-0-188.rdsnet.ro.49806: Flags [P.], seq 6774:7388, ack 728, win 262, options [nop,nop,TS val 2800373477 ecr 268305478], length 614
12:38:46.454417 IP 192-168-0-188.rdsnet.ro.49806 > bud02s35-in-f14.1e100.net.https: Flags [.], ack 7388, win 497, options [nop,nop,TS val 268305493 ecr 2800373477], length 0
12:38:46.454425 IP bud02s35-in-f14.1e100.net.https > 192-168-0-188.rdsnet.ro.49806: Flags [P.], seq 7388:7419, ack 898, win 267, options [nop,nop,TS val 2800373477 ecr 268305478], length 31
12:38:46.454427 IP 192-168-0-188.rdsnet.ro.49806 > bud02s35-in-f14.1e100.net.https: Flags [.], ack 7419, win 497, options [nop,nop,TS val 268305494 ecr 2800373477], length 0
12:38:46.454774 IP 192-168-0-188.rdsnet.ro.49806 > bud02s35-in-f14.1e100.net.https: Flags [P.], seq 2716:2747, ack 7419, win 501, options [nop,nop,TS val 268305494 ecr 2800373477], length 31
12:38:46.455514 IP bud02s35-in-f14.1e100.net.https > 192-168-0-188.rdsnet.ro.49806: Flags [.], ack 2716, win 289, options [nop,nop,TS val 2800373478 ecr 268305478], length 0
12:38:46.475215 IP bud02s35-in-f14.1e100.net.https > 192-168-0-188.rdsnet.ro.49806: Flags [.], ack 2747, win 289, options [nop,nop,TS val 2800373497 ecr 268305494], length 0
12:38:46.516228 IP 192-168-0-188.rdsnet.ro.37562 > 162.125.66.13.https: Flags [P.], seq 886690965:886691053, ack 1106893800, win 501, options [nop,nop,TS val 3390300497 ecr 587269366], length 88
12:38:46.542725 IP 162.125.66.13.https > 192-168-0-188.rdsnet.ro.37562: Flags [.], ack 88, win 130, options [nop,nop,TS val 587300404 ecr 3390300497], length 0
12:38:46.542746 IP 192-168-0-188.rdsnet.ro.37562 > 162.125.66.13.https: Flags [P.], seq 88:544, ack 1, win 501, options [nop,nop,TS val 3390300524 ecr 587300404], length 456
12:38:46.569622 IP 162.125.66.13.https > 192-168-0-188.rdsnet.ro.37562: Flags [.], ack 544, win 130, options [nop,nop,TS val 587300431 ecr 3390300524], length 0
12:38:47.028875 IP 192-168-0-1.rdsnet.ro.35257 > 192-168-0-188.rdsnet.ro.netbios-ns: UDP, length 50
12:38:47.028875 IP 192-168-0-1.rdsnet.ro.35634 > mdns.mcast.net.mdns: 17865 PTR (QM)? 192.168.0.188.in-addr.arpa. (44)
12:38:47.028878 IP 162.125.66.13.https > 192-168-0-188.rdsnet.ro.37562: Flags [P.], seq 1:1190, ack 544, win 130, options [nop,nop,TS val 587300780 ecr 3390300524], length 1189
12:38:47.028880 IP 192-168-0-1.rdsnet.ro.39767 > 192-168-0-188.rdsnet.ro.netbios-ns: UDP, length 50
12:38:47.028889 IP 192-168-0-1.rdsnet.ro.50365 > mdns.mcast.net.mdns: 17866 PTR (QM)? 192.168.0.188.in-addr.arpa. (44)
12:38:47.028898 IP 192-168-0-188.rdsnet.ro > 192-168-0-1.rdsnet.ro: ICMP 192-168-0-188.rdsnet.ro udp port netbios-ns unreachable, length 86
12:38:47.028907 IP 192-168-0-188.rdsnet.ro > 192-168-0-1.rdsnet.ro: ICMP 192-168-0-188.rdsnet.ro udp port netbios-ns unreachable, length 86
12:38:47.028908 IP bud02s35-in-f14.1e100.net.https > 192-168-0-188.rdsnet.ro.49806: Flags [P.], seq 7419:8819, ack 2747, win 289, options [nop,nop,TS val 2800373978 ecr 268305494], length 1400
12:38:47.028913 IP 192-168-0-188.rdsnet.ro.37562 > 162.125.66.13.https: Flags [.], ack 1190, win 493, options [nop,nop,TS val 3390301010 ecr 587300780], length 0
12:38:47.028916 IP bud02s35-in-f14.1e100.net.https > 192-168-0-188.rdsnet.ro.49806: Flags [P.], seq 8819:8978, ack 2747, win 289, options [nop,nop,TS val 2800373978 ecr 268305494], length 159
12:38:47.028917 IP bud02s35-in-f14.1e100.net.https > 192-168-0-188.rdsnet.ro.49806: Flags [P.], seq 8978:10378, ack 2747, win 289, options [nop,nop,TS val 2800373989 ecr 268305494], length 1400
12:38:47.028918 IP bud02s35-in-f14.1e100.net.https > 192-168-0-188.rdsnet.ro.49806: Flags [P.], seq 10378:11778, ack 2747, win 289, options [nop,nop,TS val 2800373989 ecr 268305494], length 1400
12:38:47.028919 IP bud02s35-in-f14.1e100.net.https > 192-168-0-188.rdsnet.ro.49806: Flags [P.], seq 11778:13288, ack 2747, win 289, options [nop,nop,TS val 2800373989 ecr 268305494], length 1510
12:38:47.028920 IP bud02s35-in-f14.1e100.net.https > 192-168-0-188.rdsnet.ro.49806: Flags [P.], seq 13288:14688, ack 2747, win 289, options [nop,nop,TS val 2800374004 ecr 268305494], length 1400
12:38:47.028928 IP bud02s35-in-f14.1e100.net.https > 192-168-0-188.rdsnet.ro.49806: Flags [P.], seq 14688:16088, ack 2747, win 289, options [nop,nop,TS val 2800374004 ecr 268305494], length 1400
12:38:47.028929 IP bud02s35-in-f14.1e100.net.https > 192-168-0-188.rdsnet.ro.49806: Flags [P.], seq 16088:17526, ack 2747, win 289, options [nop,nop,TS val 2800374004 ecr 268305494], length 1438
12:38:47.028930 IP bud02s35-in-f14.1e100.net.https > 192-168-0-188.rdsnet.ro.49806: Flags [P.], seq 17526:19811, ack 2747, win 289, options [nop,nop,TS val 2800374005 ecr 268305494], length 2285
12:38:47.028931 IP bud02s35-in-f14.1e100.net.https > 192-168-0-188.rdsnet.ro.49806: Flags [P.], seq 19811:21211, ack 2747, win 289, options [nop,nop,TS val 2800374018 ecr 268305494], length 1400
12:38:47.028932 IP bud02s35-in-f14.1e100.net.https > 192-168-0-188.rdsnet.ro.49806: Flags [P.], seq 21211:22611, ack 2747, win 289, options [nop,nop,TS val 2800374019 ecr 268305494], length 1400
12:38:47.028932 IP bud02s35-in-f14.1e100.net.https > 192-168-0-188.rdsnet.ro.49806: Flags [P.], seq 22611:24179, ack 2747, win 289, options [nop,nop,TS val 2800374019 ecr 268305494], length 1568
12:38:47.028936 IP bud02s35-in-f14.1e100.net.https > 192-168-0-188.rdsnet.ro.49806: Flags [P.], seq 24179:25579, ack 2747, win 289, options [nop,nop,TS val 2800374026 ecr 268305494], length 1400
12:38:47.028937 IP bud02s35-in-f14.1e100.net.https > 192-168-0-188.rdsnet.ro.49806: Flags [P.], seq 25579:26979, ack 2747, win 289, options [nop,nop,TS val 2800374026 ecr 268305494], length 1400
12:38:47.028938 IP bud02s35-in-f14.1e100.net.https > 192-168-0-188.rdsnet.ro.49806: Flags [P.], seq 26979:28244, ack 2747, win 289, options [nop,nop,TS val 2800374027 ecr 268305494], length 1265
12:38:47.028939 IP bud02s35-in-f14.1e100.net.https > 192-168-0-188.rdsnet.ro.49806: Flags [P.], seq 28244:28283, ack 2747, win 289, options [nop,nop,TS val 2800374027 ecr 268305494], length 39
12:38:47.029062 IP 192-168-0-188.rdsnet.ro.49806 > bud02s35-in-f14.1e100.net.https: Flags [.], ack 28283, win 338, options [nop,nop,TS val 268306068 ecr 2800373978], length 0
12:38:47.029226 IP 192-168-0-188.rdsnet.ro.49806 > bud02s35-in-f14.1e100.net.https: Flags [P.], seq 2747:2786, ack 28283, win 501, options [nop,nop,TS val 268306068 ecr 2800373978], length 39
12:38:47.031528 IP 192-168-0-188.rdsnet.ro.56055 > bud02s35-in-f14.1e100.net.https: UDP, length 1357
12:38:47.039333 IP bud02s35-in-f14.1e100.net.https > 192-168-0-188.rdsnet.ro.49806: Flags [P.], seq 28244:28283, ack 2747, win 289, options [nop,nop,TS val 2800374062 ecr 268305494], length 39
12:38:47.039351 IP 192-168-0-188.rdsnet.ro.49806 > bud02s35-in-f14.1e100.net.https: Flags [.], ack 28283, win 501, options [nop,nop,TS val 268306078 ecr 2800374062,nop,nop,sack 1 {28244:28283}], length 0
12:38:47.041434 IP 192-168-0-188.rdsnet.ro.34966 > 162.125.21.3.https: Flags [P.], seq 2784969571:2784969649, ack 1403697176, win 501, options [nop,nop,TS val 1583427853 ecr 552705068], length 78
12:38:47.041464 IP 192-168-0-188.rdsnet.ro.34966 > 162.125.21.3.https: Flags [.], seq 78:1478, ack 1, win 501, options [nop,nop,TS val 1583427854 ecr 552705068], length 1400
12:38:47.043008 IP 192-168-0-188.rdsnet.ro.37562 > 162.125.66.13.https: Flags [P.], seq 544:628, ack 1190, win 501, options [nop,nop,TS val 3390301024 ecr 587300780], length 84
12:38:47.043447 IP 192-168-0-188.rdsnet.ro.45686 > 192-168-0-1.rdsnet.ro.domain: 16680+ [1au] A? nsf-1.dropbox.com. (46)
12:38:47.043535 IP 192-168-0-188.rdsnet.ro.47463 > 192-168-0-1.rdsnet.ro.domain: 25314+ [1au] AAAA? nsf-1.dropbox.com. (46)
12:38:47.045589 IP bud02s35-in-f14.1e100.net.https > 192-168-0-188.rdsnet.ro.49806: Flags [.], ack 2786, win 289, options [nop,nop,TS val 2800374068 ecr 268306068], length 0
12:38:47.048765 IP bud02s35-in-f14.1e100.net.https > 192-168-0-188.rdsnet.ro.56055: UDP, length 1357
12:38:47.049205 IP 192-168-0-188.rdsnet.ro.56055 > bud02s35-in-f14.1e100.net.https: UDP, length 40
12:38:47.054966 IP 192-168-0-1.rdsnet.ro.domain > 192-168-0-188.rdsnet.ro.45686: 16680 2/0/1 CNAME nsf-env-1.dropbox-dns.com., A 162.125.66.12 (101)
12:38:47.056993 IP 192-168-0-188.rdsnet.ro.59477 > 192-168-0-1.rdsnet.ro.domain: 11224+ [1au] A? fonts.googleapis.com. (49)
12:38:47.057070 IP 192-168-0-188.rdsnet.ro.34206 > 192-168-0-1.rdsnet.ro.domain: 17756+ [1au] AAAA? fonts.googleapis.com. (49)
12:38:47.057126 IP 192-168-0-188.rdsnet.ro.42877 > 192-168-0-1.rdsnet.ro.domain: 37396+ [1au] A? www.gstatic.com. (44)
12:38:47.057176 IP 192-168-0-188.rdsnet.ro.44425 > 192-168-0-1.rdsnet.ro.domain: 45009+ [1au] AAAA? www.gstatic.com. (44)
12:38:47.068618 IP bud02s35-in-f14.1e100.net.https > 192-168-0-188.rdsnet.ro.56055: UDP, length 1357
12:38:47.068635 IP bud02s35-in-f14.1e100.net.https > 192-168-0-188.rdsnet.ro.56055: UDP, length 1357
12:38:47.068637 IP bud02s35-in-f14.1e100.net.https > 192-168-0-188.rdsnet.ro.56055: UDP, length 1357
12:38:47.068637 IP bud02s35-in-f14.1e100.net.https > 192-168-0-188.rdsnet.ro.56055: UDP, length 43
12:38:47.068644 IP 162.125.66.13.https > 192-168-0-188.rdsnet.ro.37562: Flags [.], ack 628, win 130, options [nop,nop,TS val 587300930 ecr 3390301024], length 0
12:38:47.068668 IP 192-168-0-188.rdsnet.ro.37562 > 162.125.66.13.https: Flags [P.], seq 628:979, ack 1190, win 501, options [nop,nop,TS val 3390301050 ecr 587300930], length 351
12:38:47.068828 IP 192-168-0-188.rdsnet.ro.56055 > bud02s35-in-f14.1e100.net.https: UDP, length 42
12:38:47.069644 IP 192-168-0-1.rdsnet.ro.domain > 192-168-0-188.rdsnet.ro.59477: 11224 1/0/1 A 142.251.208.138 (65)
12:38:47.074758 IP 192-168-0-1.rdsnet.ro.domain > 192-168-0-188.rdsnet.ro.47463: 25314 2/0/1 CNAME nsf-env-1.dropbox-dns.com., AAAA 2620:100:6022:12::a27d:420c (113)
12:38:47.076360 IP 192-168-0-188.rdsnet.ro.45208 > 162.125.66.12.https: Flags [S], seq 592588453, win 64240, options [mss 1460,sackOK,TS val 3742503511 ecr 0,nop,wscale 7], length 0
12:38:47.082090 IP 192-168-0-1.rdsnet.ro.domain > 192-168-0-188.rdsnet.ro.34206: 17756 1/0/1 AAAA 2a00:1450:400d:803::200a (77)
12:38:47.083026 IP bud02s35-in-f14.1e100.net.https > 192-168-0-188.rdsnet.ro.56055: UDP, length 1357
12:38:47.083232 IP 192-168-0-188.rdsnet.ro.56055 > bud02s35-in-f14.1e100.net.https: UDP, length 42
12:38:47.083965 IP 192-168-0-188.rdsnet.ro.52172 > bud02s42-in-f10.1e100.net.https: Flags [S], seq 2042545479, win 64240, options [mss 1460,sackOK,TS val 1980788980 ecr 0,nop,wscale 7], length 0
12:38:47.083988 IP 192-168-0-188.rdsnet.ro.52174 > bud02s42-in-f10.1e100.net.https: Flags [S], seq 691096695, win 64240, options [mss 1460,sackOK,TS val 1980788980 ecr 0,nop,wscale 7], length 0
12:38:47.084010 IP 192-168-0-188.rdsnet.ro.52188 > bud02s42-in-f10.1e100.net.https: Flags [S], seq 1677086382, win 64240, options [mss 1460,sackOK,TS val 1980788980 ecr 0,nop,wscale 7], length 0
12:38:47.084025 IP bud02s35-in-f14.1e100.net.https > 192-168-0-188.rdsnet.ro.56055: UDP, length 1357
12:38:47.084027 IP bud02s35-in-f14.1e100.net.https > 192-168-0-188.rdsnet.ro.56055: UDP, length 304
12:38:47.084792 IP 192-168-0-188.rdsnet.ro.56055 > bud02s35-in-f14.1e100.net.https: UDP, length 43
12:38:47.085665 IP 192-168-0-188.rdsnet.ro.56055 > bud02s35-in-f14.1e100.net.https: UDP, length 108
12:38:47.085684 IP 192-168-0-188.rdsnet.ro.56055 > bud02s35-in-f14.1e100.net.https: UDP, length 65
12:38:47.085712 IP 192-168-0-188.rdsnet.ro.49806 > bud02s35-in-f14.1e100.net.https: Flags [P.], seq 2786:2825, ack 28283, win 501, options [nop,nop,TS val 268306125 ecr 2800374068], length 39
12:38:47.085862 IP 192-168-0-188.rdsnet.ro.49806 > bud02s35-in-f14.1e100.net.https: Flags [FP.], seq 2825:2849, ack 28283, win 501, options [nop,nop,TS val 268306125 ecr 2800374068], length 24
12:38:47.089403 IP 192-168-0-1.rdsnet.ro.domain > 192-168-0-188.rdsnet.ro.44425: 45009 1/0/1 AAAA 2a00:1450:400d:807::2003 (72)
12:38:47.094597 IP 192-168-0-1.rdsnet.ro.domain > 192-168-0-188.rdsnet.ro.42877: 37396 1/0/1 A 142.251.208.163 (60)
12:38:47.095619 IP 162.125.66.13.https > 192-168-0-188.rdsnet.ro.37562: Flags [.], ack 979, win 130, options [nop,nop,TS val 587300956 ecr 3390301050], length 0
12:38:47.096449 IP 192-168-0-188.rdsnet.ro.46014 > bud02s43-in-f3.1e100.net.https: UDP, length 1357
12:38:47.102816 IP bud02s35-in-f14.1e100.net.https > 192-168-0-188.rdsnet.ro.56055: UDP, length 615
12:38:47.102820 IP bud02s35-in-f14.1e100.net.https > 192-168-0-188.rdsnet.ro.56055: UDP, length 124
12:38:47.103246 IP 192-168-0-188.rdsnet.ro.56055 > bud02s35-in-f14.1e100.net.https: UDP, length 31
12:38:47.103931 IP bud02s42-in-f10.1e100.net.https > 192-168-0-188.rdsnet.ro.52174: Flags [S.], seq 3016766146, ack 691096696, win 65535, options [mss 1412,sackOK,TS val 134204719 ecr 1980788980,nop,wscale 8], length 0
12:38:47.103973 IP 192-168-0-188.rdsnet.ro.52174 > bud02s42-in-f10.1e100.net.https: Flags [.], ack 1, win 502, options [nop,nop,TS val 1980789000 ecr 134204719], length 0
12:38:47.104041 IP bud02s42-in-f10.1e100.net.https > 192-168-0-188.rdsnet.ro.52188: Flags [S.], seq 4245134554, ack 1677086383, win 65535, options [mss 1412,sackOK,TS val 750736436 ecr 1980788980,nop,wscale 8], length 0
12:38:47.104055 IP 192-168-0-188.rdsnet.ro.52188 > bud02s42-in-f10.1e100.net.https: Flags [.], ack 1, win 502, options [nop,nop,TS val 1980789000 ecr 750736436], length 0
12:38:47.104954 IP 192-168-0-188.rdsnet.ro.52188 > bud02s42-in-f10.1e100.net.https: Flags [P.], seq 1:669, ack 1, win 502, options [nop,nop,TS val 1980789001 ecr 750736436], length 668
12:38:47.105789 IP 192-168-0-188.rdsnet.ro.52174 > bud02s42-in-f10.1e100.net.https: Flags [P.], seq 1:669, ack 1, win 502, options [nop,nop,TS val 1980789002 ecr 134204719], length 668
12:38:47.111172 IP 162.125.66.12.https > 192-168-0-188.rdsnet.ro.45208: Flags [S.], seq 413732532, ack 592588454, win 65535, options [mss 1412,sackOK,TS val 3337098639 ecr 3742503511,nop,wscale 9], length 0
12:38:47.111183 IP 192-168-0-188.rdsnet.ro.45208 > 162.125.66.12.https: Flags [.], ack 1, win 502, options [nop,nop,TS val 3742503546 ecr 3337098639], length 0
12:38:47.111648 IP 192-168-0-188.rdsnet.ro.45208 > 162.125.66.12.https: Flags [P.], seq 1:518, ack 1, win 502, options [nop,nop,TS val 3742503547 ecr 3337098639], length 517
12:38:47.118503 IP bud02s43-in-f3.1e100.net.https > 192-168-0-188.rdsnet.ro.46014: UDP, length 1357
12:38:47.118854 IP 192-168-0-188.rdsnet.ro.46014 > bud02s43-in-f3.1e100.net.https: UDP, length 40
12:38:47.123679 IP bud02s42-in-f10.1e100.net.https > 192-168-0-188.rdsnet.ro.52188: Flags [.], ack 669, win 262, options [nop,nop,TS val 750736456 ecr 1980789001], length 0
12:38:47.124726 IP bud02s42-in-f10.1e100.net.https > 192-168-0-188.rdsnet.ro.52174: Flags [.], ack 669, win 262, options [nop,nop,TS val 134204740 ecr 1980789002], length 0
12:38:47.126811 IP bud02s35-in-f14.1e100.net.https > 192-168-0-188.rdsnet.ro.56055: UDP, length 27
12:38:47.133611 IP 192-168-0-188.rdsnet.ro.49806 > bud02s35-in-f14.1e100.net.https: Flags [FP.], seq 2825:2849, ack 28283, win 501, options [nop,nop,TS val 268306173 ecr 2800374068], length 24
12:38:47.138334 IP bud02s43-in-f3.1e100.net.https > 192-168-0-188.rdsnet.ro.46014: UDP, length 1357
12:38:47.138348 IP bud02s43-in-f3.1e100.net.https > 192-168-0-188.rdsnet.ro.46014: UDP, length 1357
12:38:47.138569 IP 192-168-0-188.rdsnet.ro.46014 > bud02s43-in-f3.1e100.net.https: UDP, length 42
12:38:47.139653 IP bud02s43-in-f3.1e100.net.https > 192-168-0-188.rdsnet.ro.46014: UDP, length 1357
12:38:47.139664 IP bud02s43-in-f3.1e100.net.https > 192-168-0-188.rdsnet.ro.46014: UDP, length 481
12:38:47.140547 IP 192-168-0-188.rdsnet.ro.46014 > bud02s43-in-f3.1e100.net.https: UDP, length 43
12:38:47.141958 IP 192-168-0-188.rdsnet.ro.53186 > muc03s07-in-f99.1e100.net.http: Flags [P.], seq 427:853, ack 702, win 501, options [nop,nop,TS val 3108561741 ecr 2129475871], length 426: HTTP: POST /gts1c3 HTTP/1.1
12:38:47.143318 IP bud02s42-in-f10.1e100.net.https > 192-168-0-188.rdsnet.ro.52188: Flags [P.], seq 1:2801, ack 669, win 262, options [nop,nop,TS val 750736476 ecr 1980789001], length 2800
12:38:47.143336 IP 192-168-0-188.rdsnet.ro.52188 > bud02s42-in-f10.1e100.net.https: Flags [.], ack 2801, win 481, options [nop,nop,TS val 1980789039 ecr 750736476], length 0
12:38:47.143344 IP bud02s42-in-f10.1e100.net.https > 192-168-0-188.rdsnet.ro.52188: Flags [P.], seq 2801:4685, ack 669, win 262, options [nop,nop,TS val 750736476 ecr 1980789001], length 1884
12:38:47.143348 IP 192-168-0-188.rdsnet.ro.52188 > bud02s42-in-f10.1e100.net.https: Flags [.], ack 4685, win 467, options [nop,nop,TS val 1980789039 ecr 750736476], length 0
12:38:47.144518 IP bud02s42-in-f10.1e100.net.https > 192-168-0-188.rdsnet.ro.52174: Flags [P.], seq 1:2801, ack 669, win 262, options [nop,nop,TS val 134204760 ecr 1980789002], length 2800
12:38:47.144528 IP 192-168-0-188.rdsnet.ro.52174 > bud02s42-in-f10.1e100.net.https: Flags [.], ack 2801, win 481, options [nop,nop,TS val 1980789041 ecr 134204760], length 0
12:38:47.144532 IP bud02s42-in-f10.1e100.net.https > 192-168-0-188.rdsnet.ro.52174: Flags [P.], seq 2801:4684, ack 669, win 262, options [nop,nop,TS val 134204760 ecr 1980789002], length 1883
12:38:47.144535 IP 192-168-0-188.rdsnet.ro.52174 > bud02s42-in-f10.1e100.net.https: Flags [.], ack 4684, win 467, options [nop,nop,TS val 1980789041 ecr 134204760], length 0
12:38:47.145947 IP 162.125.66.12.https > 192-168-0-188.rdsnet.ro.45208: Flags [.], ack 518, win 130, options [nop,nop,TS val 3337098674 ecr 3742503547], length 0
12:38:47.145954 IP 162.125.66.12.https > 192-168-0-188.rdsnet.ro.45208: Flags [.], ack 518, win 130, options [nop,nop,TS val 3337098674 ecr 3742503547], length 0
12:38:47.146610 IP 192-168-0-188.rdsnet.ro.53188 > muc03s07-in-f99.1e100.net.http: Flags [S], seq 2298368357, win 64240, options [mss 1460,sackOK,TS val 3108561746 ecr 0,nop,wscale 7], length 0
12:38:47.146622 IP 192-168-0-188.rdsnet.ro.53194 > muc03s07-in-f99.1e100.net.http: Flags [S], seq 1736818378, win 64240, options [mss 1460,sackOK,TS val 3108561746 ecr 0,nop,wscale 7], length 0
12:38:47.148066 IP 162.125.66.12.https > 192-168-0-188.rdsnet.ro.45208: Flags [P.], seq 1:2801, ack 518, win 130, options [nop,nop,TS val 3337098676 ecr 3742503547], length 2800
12:38:47.148075 IP 192-168-0-188.rdsnet.ro.45208 > 162.125.66.12.https: Flags [.], ack 2801, win 481, options [nop,nop,TS val 3742503583 ecr 3337098676], length 0
12:38:47.148079 IP 162.125.66.12.https > 192-168-0-188.rdsnet.ro.45208: Flags [P.], seq 2801:3356, ack 518, win 130, options [nop,nop,TS val 3337098676 ecr 3742503547], length 555
12:38:47.148081 IP 192-168-0-188.rdsnet.ro.45208 > 162.125.66.12.https: Flags [.], ack 3356, win 477, options [nop,nop,TS val 3742503583 ecr 3337098676], length 0
12:38:47.149013 IP 192-168-0-188.rdsnet.ro.45208 > 162.125.66.12.https: Flags [P.], seq 518:611, ack 3356, win 501, options [nop,nop,TS val 3742503584 ecr 3337098676], length 93
12:38:47.150242 IP bud02s42-in-f10.1e100.net.https > 192-168-0-188.rdsnet.ro.52172: Flags [S.], seq 121941263, ack 2042545480, win 65535, options [mss 1412,sackOK,TS val 2337221797 ecr 1980788980,nop,wscale 8], length 0
12:38:47.150256 IP 192-168-0-188.rdsnet.ro.52172 > bud02s42-in-f10.1e100.net.https: Flags [.], ack 1, win 502, options [nop,nop,TS val 1980789046 ecr 2337221797], length 0
12:38:47.150260 IP bud02s35-in-f14.1e100.net.https > 192-168-0-188.rdsnet.ro.49806: Flags [.], ack 2825, win 289, options [nop,nop,TS val 2800374124 ecr 268306125], length 0
12:38:47.150263 IP bud02s35-in-f14.1e100.net.https > 192-168-0-188.rdsnet.ro.49806: Flags [F.], seq 28283, ack 2850, win 289, options [nop,nop,TS val 2800374124 ecr 268306125], length 0
12:38:47.150266 IP 192-168-0-188.rdsnet.ro.49806 > bud02s35-in-f14.1e100.net.https: Flags [.], ack 28284, win 501, options [nop,nop,TS val 268306189 ecr 2800374124], length 0
12:38:47.150270 IP bud02s35-in-f14.1e100.net.https > 192-168-0-188.rdsnet.ro.49806: Flags [.], ack 2850, win 289, options [nop,nop,TS val 2800374172 ecr 268306173,nop,nop,sack 1 {2825:2850}], length 0
12:38:47.151188 IP 192-168-0-188.rdsnet.ro.52172 > bud02s42-in-f10.1e100.net.https: Flags [P.], seq 1:669, ack 1, win 502, options [nop,nop,TS val 1980789047 ecr 2337221797], length 668
12:38:47.162968 IP 162.125.21.3.https > 192-168-0-188.rdsnet.ro.34966: Flags [.], ack 78, win 130, options [nop,nop,TS val 552733856 ecr 1583427853], length 0
12:38:47.162981 IP 192-168-0-188.rdsnet.ro.34966 > 162.125.21.3.https: Flags [P.], seq 1478:2597, ack 1, win 501, options [nop,nop,TS val 1583427975 ecr 552733856], length 1119
12:38:47.164015 IP 162.125.21.3.https > 192-168-0-188.rdsnet.ro.34966: Flags [.], ack 1478, win 130, options [nop,nop,TS val 552733857 ecr 1583427854], length 0
12:38:47.168085 IP bud02s42-in-f10.1e100.net.https > 192-168-0-188.rdsnet.ro.52172: Flags [.], ack 669, win 262, options [nop,nop,TS val 2337221864 ecr 1980789047], length 0
12:38:47.176435 IP muc03s07-in-f99.1e100.net.http > 192-168-0-188.rdsnet.ro.53188: Flags [S.], seq 84914018, ack 2298368358, win 65535, options [mss 1412,sackOK,TS val 932697104 ecr 3108561746,nop,wscale 8], length 0
12:38:47.176449 IP 192-168-0-188.rdsnet.ro.53188 > muc03s07-in-f99.1e100.net.http: Flags [.], ack 1, win 502, options [nop,nop,TS val 3108561776 ecr 932697104], length 0
12:38:47.176619 IP 192-168-0-188.rdsnet.ro.53188 > muc03s07-in-f99.1e100.net.http: Flags [P.], seq 1:428, ack 1, win 502, options [nop,nop,TS val 3108561776 ecr 932697104], length 427: HTTP: POST /gts1c3 HTTP/1.1
12:38:47.177302 IP 192-168-0-188.rdsnet.ro.46014 > bud02s43-in-f3.1e100.net.https: UDP, length 40
12:38:47.177314 IP 192-168-0-188.rdsnet.ro.46014 > bud02s43-in-f3.1e100.net.https: UDP, length 40
12:38:47.182653 IP 162.125.66.12.https > 192-168-0-188.rdsnet.ro.45208: Flags [.], ack 611, win 130, options [nop,nop,TS val 3337098710 ecr 3742503584], length 0
12:38:47.182659 IP 162.125.66.12.https > 192-168-0-188.rdsnet.ro.45208: Flags [P.], seq 3356:3614, ack 611, win 130, options [nop,nop,TS val 3337098711 ecr 3742503584], length 258
12:38:47.182883 IP 192-168-0-188.rdsnet.ro.45208 > 162.125.66.12.https: Flags [P.], seq 611:664, ack 3614, win 501, options [nop,nop,TS val 3742503618 ecr 3337098711], length 53
12:38:47.183190 IP 192-168-0-188.rdsnet.ro.45208 > 162.125.66.12.https: Flags [.], seq 664:2064, ack 3614, win 501, options [nop,nop,TS val 3742503618 ecr 3337098711], length 1400
12:38:47.183988 IP muc03s07-in-f99.1e100.net.http > 192-168-0-188.rdsnet.ro.53186: Flags [.], ack 853, win 265, options [nop,nop,TS val 2129476617 ecr 3108561741], length 0
12:38:47.189432 IP bud02s42-in-f10.1e100.net.https > 192-168-0-188.rdsnet.ro.52172: Flags [P.], seq 1:2801, ack 669, win 262, options [nop,nop,TS val 2337221885 ecr 1980789047], length 2800
12:38:47.189442 IP 192-168-0-188.rdsnet.ro.52172 > bud02s42-in-f10.1e100.net.https: Flags [.], ack 2801, win 481, options [nop,nop,TS val 1980789086 ecr 2337221885], length 0
12:38:47.189446 IP bud02s42-in-f10.1e100.net.https > 192-168-0-188.rdsnet.ro.52172: Flags [P.], seq 2801:4684, ack 669, win 262, options [nop,nop,TS val 2337221885 ecr 1980789047], length 1883
12:38:47.189448 IP 192-168-0-188.rdsnet.ro.52172 > bud02s42-in-f10.1e100.net.https: Flags [.], ack 4684, win 467, options [nop,nop,TS val 1980789086 ecr 2337221885], length 0
12:38:47.192416 IP muc03s07-in-f99.1e100.net.http > 192-168-0-188.rdsnet.ro.53194: Flags [S.], seq 2059900302, ack 1736818379, win 65535, options [mss 1412,sackOK,TS val 3860215818 ecr 3108561746,nop,wscale 8], length 0
12:38:47.192438 IP 192-168-0-188.rdsnet.ro.53194 > muc03s07-in-f99.1e100.net.http: Flags [.], ack 1, win 502, options [nop,nop,TS val 3108561792 ecr 3860215818], length 0
12:38:47.192529 IP 192-168-0-188.rdsnet.ro.53194 > muc03s07-in-f99.1e100.net.http: Flags [P.], seq 1:428, ack 1, win 502, options [nop,nop,TS val 3108561792 ecr 3860215818], length 427: HTTP: POST /gts1c3 HTTP/1.1
12:38:47.193201 IP 192-168-0-188.rdsnet.ro.53200 > muc03s07-in-f99.1e100.net.http: Flags [S], seq 357423369, win 64240, options [mss 1460,sackOK,TS val 3108561792 ecr 0,nop,wscale 7], length 0
12:38:47.196869 IP 192-168-0-188.rdsnet.ro.50506 > bud02s43-in-f3.1e100.net.https: Flags [S], seq 3361637057, win 64240, options [mss 1460,sackOK,TS val 2874935462 ecr 0,nop,wscale 7], length 0
12:38:47.196892 IP 192-168-0-188.rdsnet.ro.50520 > bud02s43-in-f3.1e100.net.https: Flags [S], seq 3332590599, win 64240, options [mss 1460,sackOK,TS val 2874935462 ecr 0,nop,wscale 7], length 0
12:38:47.196907 IP 192-168-0-188.rdsnet.ro.50524 > bud02s43-in-f3.1e100.net.https: Flags [S], seq 772440122, win 64240, options [mss 1460,sackOK,TS val 2874935462 ecr 0,nop,wscale 7], length 0
12:38:47.197908 IP bud02s43-in-f3.1e100.net.https > 192-168-0-188.rdsnet.ro.46014: UDP, length 42
12:38:47.207298 IP muc03s07-in-f99.1e100.net.http > 192-168-0-188.rdsnet.ro.53188: Flags [.], ack 428, win 261, options [nop,nop,TS val 932697134 ecr 3108561776], length 0
12:38:47.214667 IP bud02s43-in-f3.1e100.net.https > 192-168-0-188.rdsnet.ro.50520: Flags [S.], seq 3124551482, ack 3332590600, win 65535, options [mss 1412,sackOK,TS val 2722978599 ecr 2874935462,nop,wscale 8], length 0
12:38:47.214670 IP bud02s43-in-f3.1e100.net.https > 192-168-0-188.rdsnet.ro.50524: Flags [S.], seq 1861530635, ack 772440123, win 65535, options [mss 1412,sackOK,TS val 3539757093 ecr 2874935462,nop,wscale 8], length 0
12:38:47.214689 IP 192-168-0-188.rdsnet.ro.50524 > bud02s43-in-f3.1e100.net.https: Flags [.], ack 1, win 502, options [nop,nop,TS val 2874935480 ecr 3539757093], length 0
12:38:47.214698 IP 192-168-0-188.rdsnet.ro.50520 > bud02s43-in-f3.1e100.net.https: Flags [.], ack 1, win 502, options [nop,nop,TS val 2874935480 ecr 2722978599], length 0
12:38:47.215775 IP 192-168-0-188.rdsnet.ro.50524 > bud02s43-in-f3.1e100.net.https: Flags [P.], seq 1:664, ack 1, win 502, options [nop,nop,TS val 2874935481 ecr 3539757093], length 663
12:38:47.216629 IP 192-168-0-188.rdsnet.ro.50520 > bud02s43-in-f3.1e100.net.https: Flags [P.], seq 1:664, ack 1, win 502, options [nop,nop,TS val 2874935482 ecr 2722978599], length 663
12:38:47.216657 IP 162.125.66.12.https > 192-168-0-188.rdsnet.ro.45208: Flags [.], ack 664, win 130, options [nop,nop,TS val 3337098744 ecr 3742503618], length 0
12:38:47.216666 IP 192-168-0-188.rdsnet.ro.45208 > 162.125.66.12.https: Flags [P.], seq 2064:2251, ack 3614, win 501, options [nop,nop,TS val 3742503652 ecr 3337098744], length 187
